{
  "schemaVersion": 1,
  "recordType": "phase52-real-s3-system-release-gate",
  "generation": 1,
  "generationId": "sha256:3f89dc55345265e9e91243e72cea56fc91926adfe9bff80eb31a3aa0bbfb0670",
  "current": {
    "testedSourceRevision": "bc4e58a2f9986b88a7eb84b191d85824c926f9f7",
    "evidenceRepository": "mcp-mamono210/ai-agent-runner",
    "evidenceRevision": "7347410bc7fd9a0db975670c38ad1598e56b9132",
    "evidencePath": "docs/verification/phase52-real-s3-system-release-20260925T025140Z.json",
    "evidenceBlobSha": "c75d444c2ed227ac520cf39d8c01421a414bd47f",
    "rawRecordSha256": "sha256:74f8bc4f338cc5280b6d0e8bfb1c9fec24d8a06d7fa98b14d6fdb836a8cbfb74",
    "executionHost": {
      "hostProvider": "local-macos",
      "uname": {
        "sysname": "Darwin",
        "kernelRelease": "24.6.0",
        "machine": "x86_64"
      },
      "nodeVersion": "24.19.0",
      "npmVersion": "11.17.0",
      "awsCliVersion": "aws-cli/2.34.30 Python/3.14.4 Darwin/24.6.0 exe/x86_64",
      "dockerClientVersion": "29.7.2",
      "dockerServerVersion": "29.5.2"
    },
    "roleName": "Phase52AgentRunnerController",
    "normalizedPrincipalArnSha256": "sha256:4b2aa66b620fc042ca52e4300233b89caf0a138f9a21bda2694af3c094f92176",
    "iamAttestationResult": "PASS",
    "iamNegativeVerificationResult": {
      "artifactPrefix": "mcp-mamono210/ai-agent-runner/phase49/artifacts",
      "deleteObject": {
        "result": "PASS",
        "expectedError": "AccessDenied",
        "probeKeySha256": "sha256:eb392a4d09413f244be3ee74de0bd0c82a8b913340fe242f6c24b65a19cda3f1"
      },
      "listBucket": {
        "result": "PASS",
        "expectedError": "AccessDenied"
      }
    },
    "phase49VerifierRecordSha256": "sha256:f82faaf17f07f41f6626b78a22bab6d7fee97e2654dc7f167f9c251ad0f6965e",
    "failure": null,
    "checkoutClean": true,
    "result": "PASS",
    "verifiedAt": "2026-09-25T02:52:15.605Z"
  },
  "history": [],
  "supersedes": null
}
